{
  "$schema": "http://json-schema.org/draft-07/schema#",
  "title": "Legal Document Types",
  "description": "Schema for legal document types and their characteristics",
  "type": "array",
  "items": {
    "type": "object",
    "properties": {
      "name": {
        "type": "string",
        "description": "Unique name of the document type",
        "pattern": "^[a-z_]+$"
      },
      "keywords": {
        "type": "array",
        "items": {
          "type": "string"
        },
        "description": "Keywords associated with this document type",
        "minItems": 1
      },
      "description": {
        "type": "string",
        "description": "Human-readable description of the document type"
      },
      "template": {
        "type": "string",
        "description": "Template name for document generation"
      }
    },
    "required": ["name", "keywords"],
    "additionalProperties": false
  }
}